num,nombre,fecha,,
3240,"Autorización a la nación para definir un piso parael total de las apropiaciones destinadas al programa de reorganización, rediseño y modernización de las redes de prestación de servicios de salud, definido por los recaudos del IVA a los juegos de azar (Ley 788/02)",8/1/2003,,
3241,Lineamientos de política para las empresas oficiales distribuidoras de energía eléctrica,8/1/2003,,
3242,Estrategia institucional para la venta de servicios ambientales de mitigación del cambio climático,8/1/2003,,
3243,"Distribución de los excedentes financieros de 2002 de los establecimientos públicos, empresas industriales y comerciales del estado y sociedades de economía mixta",9/1/2003,,
3244,Estrategias para la dinamización y consolidación del sector Gas Natural en Colombia,9/1/2003,,
3245,Extensión de contratos de asociación,9/1/2003,,
3246,Lineamientos de política para el sector de acueducto y alcantarillado,9/1/2003,,
3248,Renovación de la administración pública,10/1/2003,,
3249,Política de contratación pública para un estado gerencial,10/1/2003,,
3250,Lineas de acción para el fortalecimiento de la defensa legal de la nación y para la valoración de pasivos contingentes,10/1/2003,,
3251,Renovación de la administración pública : programa para la gestión eficiente de activos públicos (fase I : activos fijos-inmobiliarios),10/1/2003,,
3252,Reforma al estatuto orgánico del presupuesto,10/1/2003,,
3253,Importancia estratégica del programa de modernización empresarial en el sector de agua potable y saneamiento básico,11/1/2003,,
3254,"Autorización a la Nación para contratar un empréstito externo con la Banca
Multilateral hasta por US$18,3 millones para fi nanciar el programa de la
Renovación de la Administración Pública",11/1/2003,,
3255,Lineamientos de política para la distribución del 25 por ciento de los recursos territoriales provenientes del incremento del 4 por ciento del IVA a la telefónia movil,11/1/2003,,
3256,Políticas y estrategias para la gestión concertada del desarrollo de la región Bogotá-Cundinamarca,12/1/2003,,
3257,Distribución de recursos para el Certificado de Incentivo Forestal (CIF de reforestación)- vigencia 2003,12/1/2003,,
3258,Reajuste de avalúos catastrales para la vigencia de 2004,12/1/2004,,
3259,Sistema integrado del servicio público urbano de transporte masivo de pasajeros del distrito de Cartagena - TRANSCARIBE,12/1/2003,,
3260,Política nacional de transporte urbano y masivo,12/1/2003,,
3261,Programa de infraestructura vial de integración y desarrollo regional,12/1/2003,,
3262,"Autorización a la nación para obtener un cupo de endeudamiento externo hasta por US$1, 450 millones o su equivalente en otras monedas, con el fin de financiar las apropiaciones presupuestales de la vigencia 2004-2005",1/1/2004,,
3263,Garantía de la nación a la Empresa Servicio Aéreo a Territorios Nacionales-SATENA- para la contratación de una operación de crédito público hasta por US$40.0 millones destinados a la adquisición y adecuación de un avión de transporte para el servicio de la presidencia de la república,1/1/2004,,
3264,Reestructuración financiera de ISAGEN,1/1/2004,,
3265,"Pautas para los incrementos salariales en las entidades del orden territorial, empresas industriales y comerciales del estado y sociedades de economía mixta, o con el régimen de estas, y lineamientos para la participación de los representantes del gobierno en las empresas industriales y comerciales del estado y sociedades de economía mixta : vigencia 2003 y 2004",1/1/2004,,
3266,Balance macroeconómico para 2003 y prespectivas para 2004,1/1/2004,,
3267,"Autorización a la nación para contratar empréstitos externos con la banca multilateral hasta por US$1.150 millones o su equivalente en otras monedas, destinados a financiar apropiaciones presupuestales prioritarias de las vigencias fiscales 2004-2006",1/1/2004,,
3268,Lineamientos para la posible solución negociadad de las controversias resultantes de los contratos de asociación a riesgo compartido suscritos por telecom y las teleasociadas,2/1/2004,,
3269,Bases para la optimización del programa de subsidio familiar de vivienda y lineamientos para dinamizar la oferta de crédito de vivienda de interés social,2/1/2004,,
3270,"Garantia de la nación a INFICALDAS e INFIMANIZALES, para contratar operaciones de crédito público externo con el gobierno español a través del Instituto de Crédito Oficial - ICO- hasta por US$20 millones, destinados a la financiación parcial del proyecto ""construcción del aeropuerto de palestina""",2/1/2004,,
3271,"Autorización al gobierno nacional para contratar un empréstito externo con el gobierno de España hasta por US$58, 45 millones, o su equivalente en otras monedas, para la financiación del proyecto ""construcción de la pequeña central hidroeléctrica (PCH)de Guapi e interconexión Costa Pacífica"" : modificación al documento CONPES 3192 del 31 de julio de 2002",2/1/2004,,
3272,Política integral de infraestructura vial,2/1/2004,,
3273,"Autorización a la nación para contratar operaciones de crédito externo con la banca multilateral hasta por US$600 millones, con el fin de financiar los aportes de la nación a los sistemas integrados de transporte masivo - SITM y otras apropiaciones presupuestales prioritarias de la nación para 2004",3/1/2004,,
3274,Autorización a la nación para contratar una operación de crédito externo con la banca multilateral hasta por US$20 millones para financiar el programa de apoyo al sistema nacional ambiental - SINA II,3/1/2004,,
3275,"Modificación a los documentos CONPES 2182 de 2002 y 3243 de 2003 ""distribución de los excedentes financieros de los establecimientos públicos, empresas industriales y comerciales del estado y sociedades de economía mixta""",3/1/2004,,
3276,XVII censo nacional de población y VI de vivienda año 2005,3/1/2004,,
3277,Estrategia para la expansión de la oferta nacional de cupos penitenciarios y carcelarios,3/1/2004,,
3278,"Autorización a la nación para contratar una operación de crédito externo hasta por un monto de US$ 30 millones, o su equivalente en otras monedas, con destino a la financiación del programa ""paz y desarrollo""",3/1/2004,,
3279,"Garantía de la nación a Colombia Telecomunicaciones S.A.E.S.P.para la contratación de operaciones de crédito público interno, externo y/o asimiladas hasta por $900.000 millones o su equivalente en dólares de Estados Unidos, destinadas al pago de las obligaciones resultantes de las negociaciones con los asociados en los contratos de asociación a riesgo compartido, suscrito por Telecom en liquidación y algunas Teleasociadas",4/1/2004,,
3280,Optimización de los instrumentos de desarrollo empresarial,4/1/2004,,
3281,Estrategia para adelantar un programa de aprovechamiento de activos y enajenación de participaciones de la nación y sus entidades en empresas públicas y privadas,4/1/2004,,
3282,Autorización de la nación para contratar operaciones de crédito externo hasta por US$12.9 millones o su equivalente en otras monedas con destino a la fuerza pública,4/1/2004,,
3283,"Modificación de las monedas en se pagan las asignaciones de los funcionarios diplomaticos, consulares y administrativos que laboran en Suecia, Noruega, Polonia, Federación Rusa y Sudafrica",4/1/2004,,
3284,"Autorización a la nación para contratar un empréstito externo con el banco intermericano de desarrollo hasta por US$5 millones, destinado a financiar el programa de aproyo al proceso de participación privada y concesión en infraestructura - segunda fase (PPCI II)",4/1/2004,,
3285,Autorización a la nación para la emisión de bonos agrarios ley 160 de 1994 vigencia 2004-2006,4/1/2004,,
3286,Seguimiento y directrices para el nuevo enfoque de la política cafetera,5/1/2004,,
3287,Programa de subsidio familiar de vivienda en especie en lotes de la nación,5/1/2004,,
3288,Garantía de la nación a la nueva empresa de servicios públicos que prestará el servicio de telefonía pública básica conmutada -TPBC- en Barranquilla y su área metropolitana para la operación de crédito público interno que proyecta celebrar con la banca comercial hasta por $15.000 millones,5/1/2004,,
3289,"Autorización a la nación para contratar operaciones de crédito externo hasta por US$19.6 millones, o su equivalente en otras monedas, con destino a la fuerza pública",5/1/2004,,
3290,Seguimiento a la política de empleo,6/1/2004,,
3291,Estrategia para la reactivación económica y social de Norte de Santander : 2004-2006,6/1/2004,,
3292,Proyecto de racionalización y automatización de trámites,6/1/2004,,
3293,Autorización a la nación para contratar operaciones de crédito externo hasta por US$234.56 millones o su equivalente en otras monedas para la disposición de los aviones de combate táctico de la Fuerza Aérea Colombiana,6/1/2004,,
3294,Renovación de la administración pública : gestión por resultados y reforma del sistema nacional de evaluación,6/1/2004,,
3295,"Autorización a la nación para contratar in empréstito externo con el banco internacional de reconstrucción y fomento -BIRF- hasta por $2 millones o su equivalente en otras monedas, destinado a financiar el proyecto de ""asistencia técnica para apoyar el fortalecimiento institucional del sector social y la evaluación de políticas públicas""",7/1/2004,,
3296,Lineamientos para promover la participación privada en la prestación de servicios ecoturísticos en el sistema de parques nacionales naturales - SPNN,7/1/2004,,
3297,Agenda interna para la productividad y la competitividad : metodología,7/1/2004,,
3298,Sistema integrado de servicio público urbano de transporte masivo de pasajeros del área mepropolitana de Bucaramanga,7/1/2004,,
3299,Proyecto de hidrotratamiento para la refinería de Barrancabermeja,7/1/2004,,
3300,Plan operativo anual de inversiones vigencia 2005,7/1/2004,,
3301,"Balance macroeconómico, presupuesto y plan financiero para 2005",7/1/2004,,
3302,"Autorización a la Nación para contratar un empréstito externo con el
Banco Internacional de Reconstrucción y Fomento (BIRF) hasta por
US$50 millones o su equivalente en otras monedas, destinado a fi nanciar
apropiaciones presupuestales prioritarias de la vigencia fi scal 2004 (modifi
cación al Documento Conpes 3212 del 9 de enero de 2003)",8/1/2004,,
3303,Estrategia para apoyar el desarrollo integral del departamento de Nariño,8/1/2004,,
3304,Autorización a la nación para contratar un empréstito externo con el BID hasta por US$30 millones con el fin de financiar vivienda de interés social rural 2005-2007,8/1/2004,,
3305,Lineamientos para optimizar la política de desarrollo urbano,8/1/2004,,
3306,Sistema integrado del servicio público urbano de transporte masivo de pasajeros del distrito de Barranquilla y su área metropolitana,9/1/2004,,
3307,Sistema integrado del servicio público urbano de transporte masivo de pasajeros del Valle de Aburrá,9/1/2004,,
3308,"Distribución de los excedentes financieros de 2003 de los establecimientos públicos, empresas industriales y comerciales del estado y sociedades de economía mixta",9/1/2004,,
3309,Distribución de recursos del certificado de incentivos forestales con fines comerciales (CIF de reforetación)vigencia 2004,9/1/2004,,
3310,Política de acción afirmativa para la población negra o afrocolombiana,9/1/2004,,
3311,Modificación al Conpes 3272 del 23 de febrero de 2004 : criterios para priorización de proyectos del programa de infraestructura vial y desarrollo regional,9/1/2004,,
3312,Proyecto del plan maestro de la refinería de Cartagena - PMD,9/1/2004,,
3313,Autorización a la nación para contratar una operación de crédito externo con la banca multilateral hasta por US$70 millones para financiar parcialmente el programa de apoyo al sector de agua potable y saneamiento básico,10/1/2004,,
3314,Lineamientos de política y plan de acción para la reestructuración del sector de radio y televisión pública nacional en Colombia,10/1/2004,,
3315,Inversiones estratégicas prioritarias en zonas portuarias de Colombia,10/1/2004,,
3316,Autorización a la nación para contratar un empréstito externo con la banca multilateral hasta por US$30 millones con el fin de financiar el proyecto de apoyo a la transición de la agricultura y el medio rural en Colombia,12/1/2004,,
3317,Autorización a la nación para obtener un cupo de endeudamiento externo hasta por USD 2.700 millones o su equivalente en otras monedas con destino al financiemiento de apropiaciones presupuestales de las vigencias fiscales 2005 y 2006,11/1/2004,,
3318,Autorización a la nación para contratar operaciones de crédito externo con la banca multilateral hasta por $260 millones para financiar parcialmente el programa de reducción de la vulnerabilidad fiscal del estado frente a los desastres naturales,11/1/2004,,
3319,Ajuste al régimen general de inversión extranjera de portafolio,11/1/2004,,
3320,Estrategia para el manejo ambiental del río Bogotá,12/1/2004,,
3321,Política para la utilización de excedentes de reservas técnicas del sistema general de seguridad social en empresas industriales y comerciales del estado,12/1/2004,,
3322,Propuestas para modificar el actual regimen de inversión extranjera contenido en el decreto 2080 de 2000,12/1/2004,,
3323,Programa de ampliación de la producción y optimización de los sistemas de identificación y optimización de los sistemas de identificación y registro civil de la registraduría nacional del estado civil,12/1/2004,,
3324,Modificación al CONPES 3293 del 28 de junio de 2004 - reposición de los aviones de combate táctico de la Fuerza Aérea Colombia,12/1/2004,,
3325,Reajuste avalúos catastrales para vigencia de 2005,12/1/2004,,
3326,"Garantía de la nación a Bogotá D.C.para contratar un empréstito externo con el gobierno alemán por medio del kreditanstalt fur wiederaufbau (KFW)por 3, 5 millones de euros, o su equivalente en otras monedas, para la financiación del programa sur de convivencia",12/1/2004,,
3327,Contragarantía de la nación a la financiera energética nacional S.A.y estrategia de saneamiento para la empresa de energía de Boyacá S.A.ESP,12/1/2004,,
3328,Construcción de la microcentral hidroeléctrica de Mitú (Vaupés),12/1/2004,,
3329,Censo general 2005,12/1/2004,,
3330,Distribución utilidades sociedades de economía mixta y modificaciones al CONPES 3308 de 2004,12/1/2004,,
3331,Modificación al CONPES-3272 del 23 de febrero de 2004 : vigencias futuras requeridas para el programa de infraestructura vial y desarrollo regional,12/1/2004,,
3332,Incentivo a la cobertura cambiaria en el sector agropecuario,12/1/2004,,
3333,Lineamientos de política en materia turística - proyecto Playa Blanca Barú,1/1/2005,,
3334,Actualización de la estrategia general de endeudamiento con la banca multilateral de la nación y las entidades públicas,1/1/2005,,
3335,Estrategias del gobierno nacional para apoyar el desarrollo integral del departamento del Huila,2/1/2005,,
3336,Modificación a la estrategia definida en el CONPES-3312 para la elecución del plan maestro de la refinería de Cartagena - PMD,2/1/2005,,
3337,Administración de los recursos de los fondos especiales adscritos al Ministerio de la Protección Social,2/1/2005,,
3338,Autorización a la nación para contratar empréstitos externos con la banca multilateral hasta por US $133.7 millones con el fin de financiar el programa ampliado de inmunizaciones PAI - 2005-2008,1/1/2005,,
3339,Garantía de la nación a ISAGEN S.A.ESP para la contratación de operaciones de crédito externo hasta USD 250 millones,2/1/2005,,
3340,Estrategia para el aprovechamiento de recursos públicos concentrados en GRANAHORRAR y BANCAFÉ,3/1/2005,,
3341,Balance macroeconómico 2004 y perspectivas para 2005,3/1/2005,,
3342,Plan de expanción portuaria 2005-2006 : estrategias para la competitividad del sector portuario,3/1/2005,,
3343,"Lineamientos y estrategias de desarrollo sostenible para los sectores de agua, ambiente y desarrollo territorial",3/1/2005,,
3344,Lineamientos para la formulación de la política de prevención y control de la contaminación del aire,3/1/2005,,
3345,Autorización a la nación para contratar un empréstito externo con la banca multilateral hasta por US$48 millones para financiar parcialmente el censo general 2005,3/1/2005,,
3346,"Autorización a la nación para contratar un empréstito externo con el gobierno alemán a través del KFW Bankengruppe hasta por 8, 9 millones de euros, o su equivalente en otras monedas, destinado a financiar el programa de silvicultura como alternativa de producción en la zona marginal de la región cafetera",3/1/2005,,
3347,"importancia estratégica del proyecto ""construcción de la pequeña central hifroeléctrica (PCH)de Guapi e interconexión Costa Pacífica""",4/1/2005,,
3348,Sistema integrado de servicio público urbano de transporte masivo de pasajeros del Distrito de Barranquilla y su área metropolitana - seguimiento,4/1/2005,,
3349,Sistema integrado de servicio público urbano de transporte masivo de pasajeros del Valle de Aburrá - Modificación,4/1/2005,,
3350,Empresa de acueducto y alcantarillado de San Andrés y Providencia : proyecto de importancia estratégica para el país en el marco del programa de modernización empresarial del sector,4/1/2005,,
3351,Importancia estratégica del plan de saneamiento de los caños de la cuenca oriental de la ciudad de Barranquilla,4/1/2005,,
3352,"Autorización de la nación para contratar empréstitos externos con la banca multilateral hasta por US$782, 84 millones, o su quivalente en otras monedas, para financiar parcialmente el programa de infraestructura vial de integración y desarrollo regional",5/1/2005,,
3353,Fortalecimiento de la capacidad de transporte aéreo del ejército nacional : adquisición de ocho helicópteros por un valor de hasta US$ 100 millones,5/1/2005,,
3354,Autorización a la nación para contratar operaciones de crédito externo hasta por US$36.50 millones o su equivalente en otras monedas con destino a la fuerza pública años 2005-2006,5/1/2005,,
3355,Aclaración al documento CONPES 3342 : plan de expanción portuaria 2005-2006,5/1/2005,,
3356,"Garantía de la nación a Empresas Públicas de Medellín E.S.P.para la contratación de una operación de crédito público externo con la banca multilateral hasta por US$200 millones o su equivalente en otras monedas, para la financiación del proyecto hidroeléctrico Porce III",6/1/2005,,
3357,"Autorización a la nación para contratar un emprestito externo con el gobierno de España hasta por US$146 millones, o su equivalente en otras monedas, con el fin de financiar parcialmente el proyecto ""construcción del Distrito de Riego Triangulo del Tolima""; así como declarar su importancia estrategica nacional",6/1/2005,,
3358,Meta de superávit primario 2006,6/1/2005,,
3359,"Autorización a la nación para contratar un empréstito externo con la banca multilateral hasta por US $86, 4 millones, con el fin de financiar parcialmente el Programa Familias en Acción y el fortalecimiento de la información y del sistema de Monitoreo y Evaluación del sector de la protección social",6/1/2005,,
3360,"Autorización a la nación para contratar un crédito externo con la banca multilateral hasta por US$25 millones o su equivalente en otras monedas para financiar parcialmente el proyecto ""fortalecimiento de la educación técnica y tecnológica en Colombia""",6/1/2005,,
3361,Proyectos de importancia estratégica modernización de la administración financiera del sector público (MAFP II)- desarrollo de solución que atienda los requerimientos del SIIF nación,6/1/2005,,
3362,Importancia estratégica de la construcción de la presa el Cercado y las conducciones principales hacia las areas de Rancheria y San Juan del Cesar,7/1/2005,,
3363,Proyectos estratégicos de ECOPETROL S.A.,7/1/2005,,
3364,"Balance macroeconómico, presupuesto y plan financiero para 2006",7/1/2005,,
3365,Plan operativo de inversiones vigencia 2006,7/1/2005,,
3366,Consideraciones técnicas para la evaluación de solicitudes de celebración de contratos de estabilidad jurídica,8/1/2005,,
3367,Distribución de recursos del certificado de incentivos forestales con fines comerciales (CIF de reforetación)vigencia 2005,8/1/2005,,
3368,Política nacional de transporte urbano y masivo - seguimiento,8/1/2005,,
3369,Sistema integrado de servicio público urbano de transporte masivo de pasajeros para Santiago de Cali - seguimiento,8/1/2005,,
3370,Sistema integrado de servicio público urbano de transporte masivo de pasajeros del área metropolitana de Bucaramanga - seguimiento,8/1/2005,,
3371,Lineamientos de política para la utilización eficiente de tecnologías de banda ancha inalámbricas en la banda de 3.5 GHz,8/1/2005,,
3372,"Distribución de los excedentes financieros de 2004 de los establecimientos públicos, empresas industriales y comerciales del estado y sociedades de economía mixta",8/1/2005,,
3373,"Pautas para los incrementos salariales en las entidades del orden territorial, empresas industriales y comerciales del estado y sociedades de economía mixta, o con el régimen de estas y lineamientos para la participación de los representantes del gobierno en las empresas industriales y comerciales del estado y sociedades de economia mixta : vigencia 2005",8/1/2005,,
3374,Estrategia para la sostenibilidad del actual modelo de gestión de los servicios de telecomunicaciones a cargo de la nación,8/1/2005,,
3375,Política nacional de sanidad agropecuaria e inocuidad de alimentos para el sistema de medidas sanitarias y fitosanitarias,9/1/2005,,
3376,Política sanitaria y de inocuidad para las cadenas de la carne bovina y de la leche,9/1/2005,,
3377,"Proyecto certifi cado judicial y control migratorio en línea del DAS por
valor de $78 millones de pesos",9/1/2005,,
3378,Proyecto estratégico del fondo especial cuota de fomento,9/1/2005,,
3379,Ajustes al régimen general de inversión de capital del exterior : inclusión de las operaciones de financiemiento local dentro de las modalidades de inversión y tratamiento a las operaciones de certificados de depósito,9/1/2005,,
3380,"Modificación al documento conpes 3372, ""distribución de los excedentes financieros de los establecimientos públicos, empresas industriales y comerciales del estado y sociedades de economía mixta""",9/1/2005,,
3381,Importancia estratégica de los recursos de inversión regional : agua potable y saneamiento básico,10/1/2005,,
3382,Proyectos prioritarios para mejorar la competitividad portuaria en la zona de Santa Marta - Ciénaga,10/1/2005,,
3383,Plan de Desarrollo del sector de acueducto y alcantarillado,10/1/2005,,
3384,Práctica de gobierno corporativo en empresas de servicios públicos domiciliarios : lineamientos de política,10/1/2005,,
3385,Estrategia para la sostenibilidad del actual modelo de gestión de los servicios de telecomunicaciones a cargo de la nación,10/1/2005,,
3386,Plan de acción para la focalización de los subsidios para servicios públicos domiciliarios,10/1/2005,,
3387,Modificación al CONPES 3299 por el cual se declaró estratégico el proyecto de hidrotratamiento para la refinería de Barrancabermeja,10/1/2005,,
3388,Definición del mecanismo para implememtar registro de la nueva modalidad de inversión aprobada mediante el documento CONPES 3379 de septiembre de 2005,10/1/2005,,
3389,Importancia estratégica de la construcción del proyecto las Ánimas - Nuquí,10/1/2005,,
3390,Distribución de los excedentes financieros del Fondo Nacional de Ahorro,10/1/2005,,
3391,Importancia estratégica proyecto víal Rumichaca - Pasto - Chachaguí,10/1/2005,,
3392,"Garantía de la nación al Banco Agrario de Colombia para la contratación de una operación de crédito público externo con la banca multilateral has por US$6 millones o su equivalente en otras monedas para la financiación del proyecto ""modelos innovadores de intervención para el sector cafetero""",10/1/2005,,
3393,"Garantía de la nación al departamento del Cesar para la contratación de una operación de crédito externo con la banca multilateral hasta por US$42.5 millones, o su equivalente en otras monedas, para la financiación parcial del programa de transformación estructural de la presración de los servicios de agua potable y saneamiento básico",11/1/2005,,
3394,Conexión de los distritos carboníferos a la red férrea nacional - lineamientos de política,11/1/2005,,
3395,Importancia estratégica de los laboratorios de paz en Colombia desarrollados con la operación financiera no reembolsable de la Comunidad Europea,11/1/2005,,
3396,Proyectos estratégicos del Instituto Nacional de Vias - INVIAS,11/1/2005,,
3397,Política sectorial de turismo,11/1/2005,,
3398,"Garantía de la nación a Bogotá, D.C.para contratar una operación de crédito público externo con la banca multilateral hasta por US$80 millones, o su equivalenteen otras monedas, para financiar parcialmente el programa de reducción de la vulnerabilidad fiscal y fisica del distrito capital frente a los desastres naturales",11/1/2005,,
3399,Programa de renovación de la administración pública : reforma de la institución para la regulación y la supervisión de los mercados financieros,11/1/2005,,
3400,Metas y priorización de recursos presupuestales para atender a la población desplazada por la violencia en Colombia,11/1/2005,,
3401,Política para mejorar la competitividad del sector algodonero,12/1/2005,,
3402,"Diseño, desarrollo e implantación del sistema de información misional de la Procuraduría General de la Nación",12/1/2005,,
