num,nombre,fecha,,
1951,Garantía de la Nación para respaldar un crédito que suscribirá la EEEB con el Kreditanstalt fr Wiederaufbau (KFW)para financiar parcialmente el proyecto de electrificación rural en Cundinamarca,12/1/1982,,
1952,Solicitud del municipio de Medellín para destinar la totalidad de los recursos de un crédito externo que proyecta celebrar con entidades financieras internacionales para cubrir gastos locales en su programa de inversiones 1983-1984,12/1/1982,,
1953,Garantía de la Nación para respaldar dos operaciones de crédito que suscribirá el Instituto Colombiano de Energía Eléctrica con bancos franceses para financiar el suministro de equipos de medida y protección requeridos para el plan de expansión del sistema de transmisión,12/1/1982,,
1954,Garantía de la Nación para respaldar dos operaciones de crédito externo que efectuara el ICEL con el American Express International Banking Corporation para financiar la importación de equipo con destino a la línea Betania-Popayán,12/1/1982,,
1955,Calificación del proyecto ampliación del acueducto de Barranquilla como de interés para el desarrollo económico y social del país,12/1/1982,,
1956,Documento general de conciliación de la política económica y de los objetivos de desarrollo,12/1/1982,,
1957,Proyecto Tren Metropolitano de Medellín,12/1/1982,,
1958,Capitalización de utilidades en el Banco Cafetero de Panamá,12/1/1982,,
1959,Capitalización de utilidades en el Banco del Comercio de Panamá,12/1/1982,,
1960,Refinanciación del IDEMA,12/1/1982,,
1961,Lineamientos de política para el endeudamiento público externo,1/1/1983,,
1962,Solicitud de TELECOM para ser eximida de la aplicación del Decreto 3243 de 1982,1/1/1983,,
1963,Garantía de la Nación para respaldar un crédito externo que contratará CORELCA con el Banco de Tokyo,1/1/1983,,
1964,Modificación de los términos financieros en un crédito que contratará CARBOCOL con el Lloyds Bank International y el Export Credits Guarantee Department,1/1/1983,,
1965,Recomendaciones sobre otorgamiento de certificados de desarrollo turístico para Residencias Turísticas de Betania : Neiva-Huila,2/1/1983,,
1966,Recomendaciones sobre otorgamiento de certificados de desarrollo turístico para Hotel Arimaca-Riohacha,2/1/1983,,
1967,Recomendaciones sobre otorgamiento de certificados de desarrollo turístico para Hotel de Turismo Líbano-Tolima,2/1/1983,,
1968,Recomendaciones sobre otorgamiento de certificados de desarrollo turístico para el Hotel Residencias Camino Real-Popayán-Cauca,2/1/1983,,
1969,Recomendaciones sobre otorgamiento de certificados de desarrollo turístico para Hotel Residencias Andino,2/1/1983,,
1970,Recomendaciones sobre otorgamiento de certificados de desarrollo turístico para Hotel Haricatama-Santander,2/1/1983,,
1971,Balance económico 1982 y perspectivas 1983,2/1/1983,,
1972,Plan de rehabilitación de los Ferrocarriles Nacionales,2/1/1983,,
1973,Utilización de recursos externos en la financiación de gastos locales del plan maestro del Aeropuerto El Dorado y el plan de aeropuertos fronterizos y Territorios Nacionales que realizará el DAAC,2/1/1983,,
1974,Recomendaciones sobre otorgamiento de certificados de desarrollo turístico para Hotel Camino Real-Barranquilla-Atlántico,2/1/1983,,
1975,Cuentas nacionales de Colombia,2/1/1983,,
1976,Modificación de los términos financieros en un crédito que contratará CARBOCOL con el Lloyds Bank International y el Export Credits Guarantee Department: aclaración al Doc.DNP-1964 de enero 13 de 1983,2/1/1983,,
1977,Criterios para la aplicación del Decreto 3663 de diciembre de 1982,2/1/1983,,
1978,Garantía de la Nación para respaldar un crédito externo que contratará CORELCA con el Banco de Tokyo para financiar parcialmente el proyecto Termocerrejón II : aclaración al Doc-DNP-1963-UIP de enero 13 de 1983,3/1/1983,,
1979,Crédito externo que celebrará el Ministerio de Defensa con el objeto de financiar equipo destinado a la seguridad interna,3/1/1983,,
1980,Garantía de la Nación para respaldar un crédito externo que contratará la CVC con el Eximbank del Japón para financiar la adquisición de equipo con destino al proyecto Salvajina,3/1/1983,,
1981,"Créditos externos que contratará el Ministerio de Defensa con el objeto de financiar una red integrada de comunicaciones, dotación de los comandos de desarrollo y adquisición de equipo para la Armada Nacional y la Fuerza Aérea",3/1/1983,,
1982,Garantía de la Nación para respaldar operaciones de crédito externo que celebrará CORELCA para financiar parcialmente los proyectos Termocerrejón II y subestación Cuestecita,3/1/1983,,
1983,Perspectiva fiscal y cuotas de inversión para 1984,3/1/1983,,
1984,Garantía de la Nación para respaldar varios créditos que gestionará el Instituto Colombiano de Energía Eléctrica con destino al plan de expansión del sistema de transmisión,4/1/1983,,
1985,Apoyo del Gobierno Nacional requerido por el Instituto de Fomento Industrial -IFI- en el proyecto de níquel en Cerromatoso,4/1/1983,,
1986,Crédito que contratará el ICA con el BIRF para financiar el plan nacional de investigaciones agropecuarias,4/1/1983,,
1987,"Perspectivas cambiarias, impacto monetario del crédito externo y el endeudamiento de Colombia",4/1/1983,,
1988,Créditos externos que celebrará el Ministerio de Defensa con el objeto de financiar equipos militares para la Armada Nacional y la Fuerza Aérea así como el reajuste de unos precios por adquisiciones anteriores,4/1/1983,,
1989,Lineamientos generales de la política de inversiones extranjeras,4/1/1983,,
1990,Recomendaciones sobre otorgamiento de certificados de desarrollo turístico para Hotel Chicamocha-Bucaramanga,5/1/1983,,
1991,Recomendaciones sobre otorgamiento de certificados de desarrollo turístico para Hotel Bogotá Plaza-Bogotá,5/1/1983,,
1992,"Operación de crédito externo dentro de la modalidad de apoyo institucional suscribirá la República de Colombia con el Gobierno del Canadá, según Decreto 222 de 1983",5/1/1983,,
1993,Financiación de gastos locales con los recursos de un crédito externo que contratará el BCH-Fondo Financiero de Desarrollo Urbano,5/1/1983,,
1994,Garantía de la República de Colombia para respaldar una negociación de crédito externo que suscribirá CARBOCOL con Private Export Funding Corporation y Export Import Bank de EE.UU,5/1/1983,,
1995,Garantía del Gobierno Nacional para respaldar una operación de crédito externo que proyecta celebrar el Departamento del Valle con el objeto de financiar el plan vial,5/1/1983,,
1996,Propuesta de la CCA para ensamblar vehículos Mazda en Colombia,5/1/1983,,
1997,Concepto sobre solicitud de las Empresas Públicas Municipales de Cartagena sobre exención de las normas del decreto 2248 de 1972,5/1/1983,,
1998,Recomendaciones sobre otorgamiento de certificados de desarrollo turístico para Apartahotel Davega Ltda,5/1/1983,,
1999,Recomendaciones sobre otorgamiento de certificados de desarrollo turístico para Hotel Nueva Granada-Bogotá,5/1/1983,,
2000,Expansión del sistema de generación eléctrica,5/1/1983,,
2001,Operación de crédito externo que gestionará el Gobierno Nacional con organismos internacionales de fomento para financiar la primera etapa del plan de microcentrales hidroeléctricas que ejecutará el ICEL,6/1/1983,,
2002,Informe sobre coyuntura económica,5/1/1983,,
2003,Garantía del Gobierno Nacional para respaldar una operación de crédito externo que proyecta celebrar CARBOCOL con el BIRF para financiar parcialmente un programa de expansiones carboníferas y de asistencia técnica externa,5/1/1983,,
2004,"Línea de crédito externo que suscribirá la República de Colombia con España, según Decreto 222 de 1983",5/1/1983,,
2005,Décimo quinto censo nacional de población y cuarto de vivienda,6/1/1983,,
2006,Recomendaciones sobre la propuesta para ensamblar vehículos Mazda en Colombia : adición al Doc-DNP-1996-UEI-MD-SIC-IFI,6/1/1983,,
2007,Crédito externo directo de la Nación con destino a SATENA,6/1/1983,,
2008,"Crédito externo directo de la Nación por US$200.0 millones con destino al Instituto de Fomento Industrial -IFI-, ISA, CARBOCOL, Empresas Públicas de Medellín, EAAB, según Decreto 222 de 1983",6/1/1983,,
2009,Inversión del Banco Colombo-Americano en el Banco Colombo-Americano de Panamá,6/1/1983,,
2010,Utilización del cupo especial de crédito del Gobierno Nacional en el Banco de la República previsto en la Ley 12 de 1983,7/1/1983,,
2011,Garantía de la Nación para respaldar una operación de crédito externo que proyecta celebrar el HIMAT con organismos financieros internacionales y/o gobiernos extranjeros y utilización de estos recursos para cubrir gastos locales en cuatro proyectos de adecuación de tierras,7/1/1983,,
2012,Lineamientos de política automotriz y solicitud de la CCA para el ensamble de vehículos Mazda en Colombia,7/1/1983,,
2013,Acciones de Política Sectorial del Plan Nacional de Desarrollo 1983 - 1986,8/1/1983,,
2014,Garantía de la Nación a la operación de crédito externo que gestionará el Instituto Colombiano de Energía Eléctrica -ICEL- para financiar el componente en moneda extranjera del proyecto energético de Leticia,8/1/1983,,
2015,Garantía de la Nación a las operaciones de crédito externo que gestionarán las Empresas Públicas de Medellín para el aprovechamiento múltiple del Río Grande y utilización parcial de estos recursos en gastos locales,8/1/1983,,
2016,Garantía de la Nación a la operación de crédito externo que celebrarán CORELCA y los bancos internacionales del Brasil y The Royal Bank of Canadá como agente para financiar parcialmente la línea de transmisión Termocerrejón-Cuestecita,8/1/1983,,
2017,Contratación de dos créditos externos por parte de la República de Colombia con el BID para financiar parcialmente un programa de emergencia para la reconstrucción de la Universidad del Cauca,8/1/1983,,
2018,Concepto sobre operación de crédito externo que realizará el Gobierno Nacional con destino al Ministerio de Defensa,8/1/1983,,
2019,Solicitud de modificación a algunas de las negociaciones aprobadas por el Consejo Nacional de Política Económica y Social y autorizadas con los Decretos 1218 y 1560 de 1983,8/1/1983,,
2020,Garantía de la Nación a la operación de crédito externo que proyecta celebrar el Fondo Vial Nacional y el Banco do Brasil para financiar parcialmente la adquisición de un muelle flotante para el puerto de Leticia,8/1/1983,,
2021,Garantía de la Nación a una operación de crédito externo que proyecta celebrar la CAR para financiar un proyecto de control de erosión,8/1/1983,,
2022,Consideración del proyecto agroindustrial Zulia-Ureña como de interés para el desarrollo económico y social del país,8/1/1983,,
2023,Garantía de la Nación a la operación de crédito externo que gestionará la CVC con organismos internacionales de fomento para financiar parcialmente las obras civiles del proyecto hidroeléctrico Calima III,8/1/1983,,
2024,Proyecto de montaje de una planta para la producción de papeles y cajas de cartón corrugado,9/1/1983,,
2025,Lineamientos de política de ensamble industrial en Colombia,9/1/1983,,
2026,Situación financiera de CARBOCOL-proyecto Cerrejón-zona norte,8/1/1983,,
2027,Recomendaciones sobre otorgamiento de certificados de desarrollo turístico para el Hotel Humboldt-Bogotá,8/1/1983,,
2028,Contratación de un crédito externo por parte de TELECOM para financiación de gastos locales y refinanciación de cartas de crédito en moneda extranjera,9/1/1983,,
2029,Informe de los resultados del estudio de factibilidad sobre la construcción de una planta de amoníaco-urea en el país,9/1/1983,,
2030,Inversión colombiana en el exterior en actividades financieras,9/1/1983,,
2031,Programa de endeudamiento externo-grupo de consulta : versión preliminar,9/1/1983,,
2032,"Actividades consideradas como de interés para el desarrollo económico y social para los efectos del artículo 15, numeral 5o, del Decreto 2579 de 1983",9/1/1983,,
2033,Crédito del BIRF a la FEN por $370 millones,9/1/1983,,
2034,Revisión de una operación de crédito externo aprobada por el Consejo Nacional de Política Económica y Social en su sesión del 12 de agosto de 1983,9/1/1983,,
2035,Solicitud de las Empresas Municipales de Cali para obtener la garantía de la Nación a una operación de crédito externo,9/1/1983,,
2036,Política de financiamiento del IDEMA,9/1/1983,,
2037,Proyecto hidroeléctrico del Guavio : crédito BID por US$340 millones,9/1/1983,,
2038,Financiamiento de obras públicas a través del Banco del Estado,9/1/1983,,
2039,Concepto sobre modificación a dos operaciones de crédito externo que celebrará la República de Colombia destinadas a financiar la compra de puentes de emergencia por parte del Fondo Vial Nacional,9/1/1983,,
2040,Concepto sobre una operación de crédito externo que proyecta celebrar el Gobierno Nacional con organismos financieros internacionales para financiar parcialmente el programa de desarrollo rural integrado en Boyacá y Santander,10/1/1983,,
2041,Garantía de la República de Colombia para respaldar una negociación de crédito externo que suscribirá CARBOCOL con la Agencia de Crédito a la Exportación de Holanda -N.C.M.- y el A.B.N.Bank,10/1/1983,,
2042,"Concepto sobre cuatro operaciones de crédito externo que realizará el Gobierno Nacional con destino al Ministerio de Defensa, según ley 74 de 1981",10/1/1983,,
2043,Fondo Nacional de Pensiones,10/1/1983,,
2044,Modernización del Sistema Nacional de Empleo,10/1/1983,,
2045,Crédito externo que proyecta celebrar el Gobierno Nacional y el BIRF para financiar parcialmente el proyecto de reconstrucción de Popayán y el Cauca,10/1/1983,,
2046,Situación y perspectivas del mercado laboral,10/1/1983,,
2047,Garantía de la Nación a una operación de crédito externo con monetización que proyectan celebrar el Distrito Especial de Bogotá y el BID para financiar parcialmente el proyecto Ciudad Bolívar,10/1/1983,,
2048,Situación actual y perspectivas de las tarifas de servicios públicos,10/1/1983,,
2049,Plan nacional de desarrollo cambio con equidad : plan de inversión sector vial 1983-86,1/1/1984,,
2050,Porcentaje de reajuste de los avalúos catastrales según artículo 7o.de la Ley 14 de 1983,10/1/1983,,
2051,Importaciones oficiales y bases de política para su reorientación,12/1/1983,,
2052,"Modificaciones presentadas por el Gobierno al proyecto de ley 100 de la Cámara y 169 del Senado ""por medio del cual se organiza, regula y fiscaliza la prestación de los servicios domiciliarios y se dictan otras disposiciones""",11/1/1983,,
2053,Proyecto para anticipar las exportaciones del carbón del Cerrejón zona norte,11/1/1983,,
2054,Reorientación de parte de los recursos de un crédito del BID hacia el Cauca,11/1/1983,,
2055,Solicitud de la CAR para ampliación de una garantía y de una monetización aprobadas por el Consejo Nacional de Política Económica y Social,12/1/1983,,
2056,Solicitud de CARBOCOL para utilizar recursos externos en la financiación de gastos locales del programa de exploraciones carboníferas y de asistencia técnica externa,12/1/1983,,
2057,Garantía de la Nación para una operación de crédito externo que proyecta celebrar el DAAC para financiar parcialmente la segunda etapa del plan nacional de navegación aérea,12/1/1983,,
2058,Monetización del saldo de un crédito externo contratado por el Municipio de Medellín,12/1/1983,,
2059,"Solicitud de modificación de una negociación aprobada por el Consejo Nacional de Política Económica y Social y autorizada, según Decreto 2178 de 1979",12/1/1983,,
2060,Garantía de la Nación a la operación de crédito externo que gestionará el Instituto Colombiano de Energía Eléctrica -ICEL- para el plan de inversiones en los Territorios Nacionales y áreas de frontera,12/1/1983,,
2061,Política de reestructuración y financiamiento del IDEMA,12/1/1983,,
2062,Crédito externo que proyecta negociar el Ministerio de Educación para financiar la adquisición de equipos y materiales didácticos para el sector educativo Campaña de Instrucción Nacional,12/1/1983,,
2063,Crédito externo que proyecta negociar el Ministerio de Educación para financiar la adquisición de material y equipo para el sector educativo y que involucra financiación de gastos locales,12/1/1983,,
2064,Ampliación de la resolución 37 del Consejo Nacional de Política Económica y Social,12/1/1983,,
2065,Propuesta de régimen especial de renta presuntiva para los distritos fronterizos,12/1/1983,,
2066,Concepto sobre una operación de crédito externo que realizará el Gobierno Nacional con destino al Ministerio de Defensa Nacional,12/1/1983,,
2068,Solicitud de modificación de tarifas de la EEEB,12/1/1983,,
2069,Plan nacional para el desarrollo de la microempresa,3/1/1984,,
2070,Acciones complementarias de empleo a corto plazo,1/1/1984,,
2071,Destinación de los recursos de bonos Ley 20 del Instituto de Fomento Industrial,1/1/1984,,
2072,Garantía de la Nación para respaldar operaciones de crédito externo que proyectan celebrar el INSFOPAL y el BID y utilización de estos recursos externos para financiar gastos locales en proyectos de acueducto y alcantarillado,1/1/1984,,
2073,Ampliación de las metas de construcción de vivienda del ICT para 1984-1986,1/1/1984,,
2075,Garantía de la República de Colombia para respaldar una negociación de crédito externo que suscribirá CARBOCOL con Berliner Handels Und Frankfurter Bank y el Hessische Landesbank,2/1/1984,,
2076,Garantía de la Nación para respaldar una negociación de crédito externo que suscribirá el Banco de la República con el Kreditanstalt fr Wiederaufbau (KFW)de Alemania con destino a la Corporación Financiera Popular y utilización parcial de estos recursos para cubrir gastos locales del programa,2/1/1984,,
2077,Garantía de la República de Colombia para respaldar una negociación de crédito externo que suscribirá CORELCA con el Kreditanstalt fr Wiederaufbau (KFW),2/1/1984,,
2078,Documento de coyuntura económica evaluación de la política macroeconómica,2/1/1984,,
2079,Recomendaciones sobre otorgamiento de certificados de desarrollo turístico para Apartahotel Fronteras San Andrés Islas,2/1/1984,,
2080,Recomendaciones sobre otorgamiento de certificados de desarrollo turístico para hostería San Luis de Ucuenga Nobsa Boyacá,2/1/1984,,
2081,Estrategia de financiamiento para el desarrollo de La Guajira,2/1/1984,,
2082,Ampliación de la garantía de la Nación para un crédito externo que gestionará la CVC con organismos internacionales de fomento para financiar parcialmente las obras civiles del proyecto Calima III,2/1/1984,,
2083,Directrices de la política macroeconómica en 1984,2/1/1984,,
2084,Consideraciones sobre el programa de vivienda 1984,2/1/1984,,
2085,Créditos externos que celebrará el Ministerio de Defensa con el objeto de financiar armamento menor con destino al Ejercito Nacional y la Infantería de Marina,3/1/1984,,
2086,Garantía de la Nación a una operación de crédito externo que proyecta celebrar el departamento del Chocó con organismos financieros internacionales y/o gobiernos extranjeros para financiar la adquisición de maquinaria de obras públicas,3/1/1984,,
2087,Programa nacional de desarrollo de las poblaciones indígenas,3/1/1984,,
2088,Aclaración sobre otorgamiento de la garantía de la Nación a una operación de crédito externo,3/1/1984,,
2089,Garantía de la Nación para respaldar una operación de crédito externo que suscribirá el Banco de la República con entidades financieras de fomento con destino a la Corporación Financiera Popular y utilización parcial de estos recursos para cubrir gastos locales del programa,3/1/1984,,
2090,Informe de progreso del plan nacional de rehabilitación,3/1/1984,,
2091,Crédito externo que celebrará el Ministerio de Defensa Nacional con el objeto de financiar la adquisición de equipo para la Armada Nacional,3/1/1984,,
2092,Utilización del cupo especial de crédito del Gobierno Nacional en el Banco de la República previsto en la Ley 12 de 1983,3/1/1984,,
2093,Plan de desarrollo cambio con equidad programa de inversiones de ECOPETROL 1984-1988,4/1/1984,,
2094,Ejecución de la política industrial,4/1/1984,,
2096,Situación y perspectivas de la industria manufacturera,5/1/1984,,
2097,Lineamientos para una política nacional de recreación popular,4/1/1984,,
2098,"Campaña de instrucción nacional balance, perspectivas y financiación",4/1/1984,,
2099,Ampliación de la garantía de la Nación para un crédito externo que gestionarán las Empresas Municipales de Cúcuta,5/1/1984,,
2100,Garantía de la Nación para respaldar un crédito externo entre el Banco de la República y el BIRF para contratar la IX línea de crédito BIRF destinada al financiamiento de proyectos industriales a través de las corporaciones financieras privadas y utilización de los recursos,5/1/1984,,
2101,Crédito externo que suscribirá el Ministerio de Defensa Nacional con destino a la financiación de siete helicópteros artillados y sus accesorios con destino a las fuerzas militares,5/1/1984,,
2102,Crédito externo que suscribirán el Ministerio de Defensa e Israel General Trading Co.para la adquisición de equipo de comunicaciones con destino al ejército nacional,5/1/1984,,
2103,Crédito externo que suscribirá el Ministerio de Defensa Nacional con destino a la financiación de equipo de transporte para la Policía Nacional,5/1/1984,,
2104,Situación fiscal y las cuotas de inversión para 1985,5/1/1984,,
2105,Capitalización de excedentes de utilidades para nuevos proyectos de exportación,5/1/1984,,
2106,Revisión del plan de expansión para la generación eléctrica y situación financiera del sector,5/1/1984,,
2107,Garantía de la nación a una operación de crédito interno que celebrarán solidariamente la Empresa Colombiana de Minas -ECOMINAS- y la Empresa Mineros del Chocó S.A.con el Instituto de Fomento Industrial -IFI-,5/1/1984,,
2108,Crédito externo que proyecta celebrar el Gobierno Nacional Ministerio de Hacienda para cubrir las necesidades financieras del IDEMA,5/1/1984,,
2109,Política sobre el papel de la mujer campesina en el desarrollo agropecuario,5/1/1984,,
2110,Garantía de la nación para respaldar 2 operaciones de crédito externo que celebrará CARBOCOL por US$100 millones y emisión de bonos en yenes en el mercado de capitales privado del Japón para financiar parcialmente el proyecto del Cerrejón zona norte,5/1/1984,,
2111,Garantía de la nación para respaldar operación de crédito externo que proyectan celebrar FEDECAFE y el BIRF para financiar parcialmente el proyecto de diversificación cafetera -V plan quinquenal- y utilización de estos recursos externos para cubrir gastos locales del programa,5/1/1984,,
2112,"Convenio denominado ""Protocolo Colombo-Español de Asistencia Técnica"" y crédito externo que celebrará el gobierno nacional -Ministerio de Educación- en desarrollo del protocolo para financiar la adquisición de material y equipo para el sector educativo",5/1/1984,,
2113,Recomendaciones sobre el otorgamiento de Certificados de Desarrollo turístico para la Sociedad Hotel de Pereira S.A.por la construcción del Hotel Pereira,5/1/1984,,
2114,Garantía de la nación a operación de crédito externo que celebrará el ICFES con organismos financieros internacionales de fomento para financiar parcialmente el Sistema de Educacion Superior Abierta y a Distancia -SED- y utilización parcial de estos recursos externos para cubrir gastos locales del programa,5/1/1984,,
2115,Contratación de crédito externo por parte del gobierno nacional con destino a varias entidades del sector público para la financiación de inversiones en diversos proyectos y monetización parcial de los recursos,5/1/1984,,
2116,Propuesta de distribución para 1984 de los recursos que le corresponden a la Caja Agraria por concepto de la Ley 68 de 1983,5/1/1984,,
2117,Propuesta de distribución de los recursos que por concepto de la Ley 68 de 1983 corresponden al IFI para 1984,5/1/1984,,
2118,Bases para la reorientación de la política de parques industriales,6/1/1984,,
2119,Lineamientos de política para el fomento pesquero,7/1/1984,,
2120,Proyecto hidroeléctrico de Urrá : créditos de banca de fomento por US$789 millones,6/1/1984,,
2121,Programa de adecuación de tierras,6/1/1984,,
2122,Recomendaciones sobre el otorgamiento de certificados de desarrollo turístico para la Sociedad Bentana Ltda.por la construcción del apartahotel Charleston en Bogotá,7/1/1984,,
2123,Reorientación por parte de los recursos de un crédito del gobierno nacional con el BIRF hacia Popayán,7/1/1984,,
2124,Solicitud del ICFES para ampliar el valor de la monetización de recursos externos de un crédito que proyecta celebrar con el BID destinado a financiar el Programa de Educación Superior Abierta y a Distancia SED,7/1/1984,,
2125,Situación actual de CARBOCOL,7/1/1984,,
2126,Propuesta de nueva metodología para el otorgamiento de los Certificados de Desarrollo Turístico,7/1/1984,,
2127,Informe de progreso del Plan Nacional de Rehabilitación para la paz,7/1/1984,,
2128,Proyecto de ley por medio del cual se estructuran las zonas francas colombianas,7/1/1984,,
2129,Solicitud de CARBOCOL para monetizar recursos provenientes de dos operaciones de crédito externo que proyecta celebrar con bancos extranjeros y destinadas a financiar el proyecto Cerrejón zona norte,7/1/1984,,
