num,nombre,fecha,,
0,Planeación en Colombia,6/1/1967,,
1,Reglamento de operaciones del Fondo Nacional de Proyectos de Desarrollo,10/1/1967,,
2,Producto interno bruto trimestral generado en la industria manofacturera,9/1/1968,,
3,Proyecto de contrato entre el Gobierno Nacional y el Banco de la República para la constitución de la cuenta Fondo Nacional de Proyectos de Desarrollo Contrato B-1,10/1/1967,,
4,Proyectos presentados para financiación externa junio 1967-diciembre 1968,10/1/1967,,
5,Proyectos presentados para financiación del Export-Import Bank of Washington,10/1/1967,,
6,Coordinación de los acuerdos de complementación,10/1/1967,,
7,Solicitud de los gobiernos de Colombia y Venezuela al Fondo Especial de las Naciones Unidas para un Programa de Desarrollo de la Media y Alta Guajira,10/1/1967,,
8,Informe sobre la asignación presupuestal a la Central Termoeléctrica de Barrancabermeja para 1968,10/1/1967,,
9,Informe sobre las alternativas de suministro de energía de los departamentos de Santander del Sur y Norte de Santander,10/1/1967,,
10,Información sobre el Fondo Nacional de Proyectos de Desarrollo (FONADE),10/1/1967,,
11,Procedimiento para obtener autorización para gestionar préstamos externos,10/1/1967,,
12,Informe preliminar de la Comisión de ensamble automotor,10/1/1967,,
13,Solicitud de préstamo del Instituto de Crédito Territorial al BID para el Programa BID-4,10/1/1967,,
14,Projects Presented for External Financing June 1967- December 1968,10/1/1967,,
15,Description of Some of the Projects Presented for External Financing,10/1/1967,,
16,"Simposio Colombo-Venezolano sobre desarrollo integrado de La Guajira : Maracaibo, 12-16 de septiembre de 1967 : acta final",9/1/1967,,
17,"Préstamo AID-514-L-049 : política cafetera (IMF 18; IBRD II-D): revisión del trimestre que termina el 30 de septiembre, 1967",10/1/1967,,
18,Description of Some the Projects Presented for External Financing,10/1/1967,,
19,"Contenido de un plan de desarrollo integral, regional y metropolitano para el Valle de Aburra y de Medellín",10/1/1967,,
20,"Modificación al contrato de préstamo BIRF-369-CO., firmado el 7 de febrero de 1964 para el proyecto Nare, de las Empresas Públicas de Medellín",10/1/1967,,
21,Informe del movimiento de inversiones extranjeras,10/1/1967,,
22,"Inversiones del Banco Cafetero y la Corporación Financiera Nacional (Medellín)en la Ecuatoriana de Desarrollo, Corporación Financiera (Ecuador)",10/1/1967,,
23,Inversión de la Compañía Colombiana de Seguros en la Reaseguradora Colon (Panamá),10/1/1967,,
24,Solicitud de aumento en la remesa de utilidades de la Hawailan Agronomics Co,10/1/1967,,
25,Solicitud de aumento en la remesa de utilidades : Carib Inn,10/1/1967,,
26,Garantía del Gobierno Nacional para respaldar el crédito para la adquisición de locomotoras por parte de los Ferrocarriles Nacionales,10/1/1967,,
27,Informe sobre la revisión del Arancel de Aduanas y la creación del Comité de Reforma Arancelaria,10/1/1967,,
28,Informe sobre las alternativas de suministro de energía a los Departamentos de Santander y Norte de Santander,11/1/1967,,
29,Financiación del programa de inversiones públicas nacionales para los años de 1968 y 1969,11/1/1967,,
30,"Informe de la misión del Departamento Administrativo de Planeación al BID, BIRF y EXIMBANK - octubre 13 al 29 de 1967",11/1/1967,,
31,Proyectos de resoluciones para reglamentar las propuestas de fabricación de automotores,11/1/1967,,
32,Decreto 2080 del 10 de noviembre de 1967 mediante el cual se dispone el establecimiento del Fondo Nacional de Proyectos de Desarrollo,11/1/1967,,
33,Información preliminar curso práctico del BID preparación de proyectos : mayo 1968,11/1/1967,,
34,Inversión en el sector energía,11/1/1967,,
35,Garantía del IFI para el empréstito a la Empresa de Teléfonos de Bogotá para la financiación de la deuda,11/1/1967,,
37,Contenido de un plan de desarrollo integral regional y metropolitano para la Sabana y Bogotá,10/1/1967,,
38,Aide memoire' de las negociaciones con el BID sobre la solicitud de préstamo del Instituto de Crédito Territorial para la financiación del programa BID-4,11/1/1967,,
39,Programa sectorial para agricultura,12/1/1967,,
40,Reuniones Colombo-Chilenas y Colombo-Venezolanas sobre industria automotriz,12/1/1967,,
41,Integración fronteriza Colombo-Venezolana-Comisión de Aguas Guajira : Documentos relativos a la reunión efectuada en Maicao,11/1/1967,,
42,Minuta de contrato de sub-préstamo para la financiación de estudios con cargo al préstamo AID-514-L-025,12/1/1967,,
43,Informe al CIAP : resumen del programa de inversiones públicas colombianas 1968,1/1/1968,,
44,Cuarta reunión de la Comisión permanente de integración económica Colombo-Venezolana,1/1/1968,,
45,"Plan de desarrollo integral, regional y metropolitano para los municipios asociados del Valle de Aburra : descripción del estudio : programa general",1/1/1968,,
46,"Inversión de capital colombiano en el extranjero : Gaseosas Lux, Distral, Colseguros",1/1/1968,,
47,Informe sobre el proyecto de desarrollo hidráulico del Chocó,1/1/1968,,
48,Informe sobre el proyecto de desarrollo hidráulico del Chocó,1/1/1968,,
49,Informe al Consejo Nacional de Política Económica sobre el estado actual de los proyectos del grupo consultivo,1/1/1968,,
50,Financiación del Gobierno de los Estados Unidos a Colombia en 1968 : préstamo de programas y excedentes agrícolas,1/1/1968,,
51,Instrucciones a la Delegación Colombiana que asistirá a la IV reunión de la Comisión Permanente de Integración Económica Colombo-Ecuatoriana : Quito 22-27 enero 1968,1/1/1968,,
52,Informe conjunto sobre la electrificación de los Santanderes : Instituto de Aprovechamiento de Aguas y Fomento Eléctrico.Departamento Administrativo de Planeación.Central Hidroeléctrica del Lebrija S.A,1/1/1968,,
53,Garantía del Gobierno Nacional para respaldar el crédito para la adquisición e instalaciones de los materiales y equipos electromecánicos de la Central Hidroeléctrica del Río Prado,2/1/1968,,
54,Garantía del Gobierno Nacional para respaldar el crédito para la adquisición de 1.200 vagones de carga por parte de los Ferrocarriles Nacionales,2/1/1968,,
55,Plataforma de industrialización : revisión de la política de precios en Colombia,2/1/1968,,
56,Solicitud de préstamo del Gobierno de Colombia al Banco Interamericano de Desarrollo para la construcción de la carretera La Yé-Santa Marta-Riohacha-Paraguachón,2/1/1968,,
57,Préstamo AID-514-L-049 : política de industrialización (IMF 20-21 IBRD IIC). Revisión del trimestre que termina el 31 de diciembre de 1967,2/1/1968,,
58,Proyecciones de ingresos y gastos efectivos del Gobierno Nacional en 1968,2/1/1968,,
59,Préstamos AID-514-L-049 : situación presupuestal y de tesorería (IMF-19-IBRD III). Revisión del trimestre que termina el 31 de diciembre de 1967,2/1/1968,,
60,Préstamo AID-514-L-049 : política agrícola (IBRD II-D). Revisión que trimestre que termina el 31 de diciembre 1967,2/13/1968,,
62,Inversión privada extranjera en Colombia,2/1/1968,,
64,Integración fronteriza Colombo-Venezolana : documento preparado para el VIII Congreso de Municipalidades de Colombia,2/1/1968,,
65,Informe al BIRF sobre el estado actual de los proyectos del grupo consultivo,2/1/1968,,
66,Garantía del Gobierno Nacional para respaldar el crédito del BID al Banco Ganadero,2/1/1968,,
67,Disposiciones legales sobre la contratación de préstamo,2/1/1968,,
68,Garantía del Gobierno Nacional para respaldar el Crédito Export Import Bank de Washington a las Empresas Públicas Municipales de Barranquilla,2/1/1968,,
69,Plataforma de industrialización : proyectos de decreto sobre compras oficiales,3/1/1968,,
70,Concepto de Planeación sobre la solicitud de la Fuerza Aérea Colombiana para la adquisición de 40 aviones de entrenamiento básico,3/1/1968,,
71,Análisis y recomendaciones sobre la propuesta del BID con relación a la estructura de las tasas de interés del Instituto de Crédito Territorial,2/1/1968,,
74,Información sobre el Fondo Nacional de Proyectos de Desarrollo (FONADE),3/1/1968,,
75,Garantía del Gobierno Nacional para respaldar el crédito del Gobierno de Holanda al Banco Ganadero,3/1/1968,,
76,AID-Memoria de las negociaciones con el BID sobre la solicitud de préstamo para la financiación del tramo de la Ye-Paraguachón de la carretera troncal transversal del Caribe,3/1/1968,,
78,Plataforma de industrialización : criterios para evaluar una solicitud de elevación de las utilidades con derecho a giro del capital extranjero por encima del 10 por ciento anual,3/1/1968,,
79,Plan de inversiones públicas 1969-1970-1971 : instrucciones para la tramitación de los formularios,3/1/1968,,
80,Inversión de capital extranjero en Colombia e inversión de capital colombiano en el exterior : Banco Urquijo (España)en el Banco de Bogotá.Banco de Bogotá en el Banco Urquijo,4/1/1968,,
81,Propuesta de distribución de fondos de contrapartida en 1968,4/1/1968,,
82,Plataforma de industrialización : proyecto de decreto sobre compras oficiales con destino a los programas de inversiones públicas,3/1/1968,,
83,Situación financiera de la CVC,3/1/1968,,
84,Inversión de Standard Oil Company de California y the Hanna Mining Company en Compañia Minera Cerromatoso,4/1/1968,,
85,Garantía del gobierno nacional para respaldar el préstamo del Banco Interamericano de Desarrollo a la Universidad del Valle (Cali),4/1/1968,,
86,Acuerdo de complementación de la industria del vidrio,4/1/1968,,
87,Análisis de inversiones en energía eléctrica del modelo de simulación desarrollado en la Universidad de Harvard,4/1/1968,,
88,Asistencia técnica de la AID.Propuesta del Departamento Administrativo de Planeación sobre la Cuenta en Administración,4/1/1968,,
90,Informe sobre la asistencia técnica de la ONU a Colombia,4/1/1968,,
91,Informe de la Misión del Banco Mundial y el BID,4/1/1968,,
92,Garantía del Gobierno Nacional para respaldar el préstamo del BIRF a la Empresa de Acueducto y Alcantarillado de Bogotá,5/1/1968,,
93,Garantía del Gobierno Nacional para respaldar el préstamo del BIRF a la Empresa de Energía Eléctrica de Bogotá,5/1/1968,,
94,Garantía del Gobierno Nacional para respaldar el préstamo del BIRF al Banco de la República,5/1/1968,,
95,Fondo Nacional de Proyectos de Desarrollo como instrumento fundamental de la planeación,4/1/1968,,
96,Industria automotriz de Colombia : resultados de la encuesta,5/1/1968,,
97,Evaluación de la solicitud de préstamo del INA al BID para un programa nacional de tratamiento y almacenaje de granos,5/1/1968,,
99,Plan de inversiones públicas 1968-1971 : proyección de ingresos y gastos,5/1/1968,,
100,Inversión de capital colombiano en el exterior : Confecciones Ego Ltda.de Colombia en Mexego S.A.de México,5/1/1968,,
101,Información sobre la inversión privada extranjera en Colombia en 1968,5/1/1968,,
102,Revisión de la política de control directo de los precios (en desarrollo del documento DAP-55-GES presentado al Consejo Nacional de Política Económica y Social el 19 de abril de 1968),6/1/1968,,
103,Procesamiento electrónico de la información en las entidades oficiales del país : análisis técnico y económico,6/1/1968,,
104,Síntesis del proyecto INA-INAGRARIO S.A.para financiamiento del BID,6/1/1968,,
105,Propuesta de reestructuración de las instituciones que dirigen el comercio exterior nacional,6/1/1968,,
106,Garantía del Gobierno Nacional para respaldar la financiación que concede la firma Continental-Moss-Gordin Inc.al Instituto de Fomento Algodonero,6/1/1968,,
109,Necesidades de financiación para el programa de inversiones públicas 1969 y 1971 : presentación ante la comisión de reforma tributaria junio 1.de 1968,9/1/1968,,
110,Contrato de consultoría sugerido por los estudios financiados con préstamos del Fondo Nacional de Proyectos de Desarrollo,7/1/1968,,
111,Revisión de la política nacional de precios : productos agropecuarios,7/1/1968,,
112,Informe anual del Departamento Administrativo de Planeación - 1967-1968,7/1/1968,,
113,Memorando sobre los términos del acuerdo final con la AID sobre el préstamo de programa y al préstamo sectorial agrícola para 1968,7/1/1968,,
114,Electroaguas y la electrificación del país,7/1/1968,,
115,Términos de financiación ofrecidos por el Bank of America para el préstamo con destino al Palacio de Justicia,7/1/1968,,
116,Préstamo del Banco Mundial al Ministerio de Obras Públicas para la financiación del programa de construcción y mejoramiento de carreteras,7/1/1968,,
117,Garantía del Gobierno al préstamo del Banco Mundial para el equipamiento y rehabilitación de los Ferrocarriles Nacionales,7/1/1968,,
118,Préstamos del Banco Mundial al Ministerio de Educación para la financiación parcial del plan nacional del Instituto de Educación Media Diversificada,7/1/1968,,
119,Recomendaciones del Consejo Nacional de Política Económica y Social al Consejo de Regulación Económica sobre el mecanismo de control de precios,7/1/1968,,
120,Programa de financiamiento externo 1968-1973,8/1/1968,,
121,"Papel del capital foráneo público y privado en el desarrollo de Colombia : Conferencia dictada por el doctor Edgar Gutiérrez Castro, ante la Cámara de Comercio Colombo Americana",8/1/1968,,
122,Desarrollo turístico en el Parque Natural de Santa Marta,8/1/1968,,
123,Informe de la Misión a Italia y Alemania para negociar la financiación conjunta del tercer programa de ensanches de la energía de Bogotá y otros asuntos relativos al financiamiento externo,8/1/1968,,
124,Modelo para los contratos de préstamo del Fondo Nacional de Proyectos de Desarrollo,8/1/1968,,
125,Recomendaciones del Consejo Nacional de Política Económica y Social a las entidades del manejo de los bienes agropecuarios,8/1/1968,,
126,Disposiciones legales sobre la contratación de credito externo,8/1/1968,,
127,Análisis de capacidad de endeudamiento externo de Colombia : datos del período 1956-1967 y proyecciones para 1968-1972,8/1/1968,,
128,Inversión de capital colombiano en el exterior : Confecciones Ego Ltda.,9/1/1968,,
129,Garantía del Gobierno Nacional para respaldar la financiación que conceden el tesoro francés y un consorcio de bancos franceses al Instituto de aprovechamiento de aguas y fomento eléctrico,9/1/1968,,
130,Aplicación de la garantía del Gobierno Nacional para respaldar la operación de financiación al tercer programa de ensanche de energía eléctrica de Bogotá,9/1/1968,,
131,Proyecto de memorando para el Banco Mundial sobre préstamos de programa,9/1/1968,,
132,Efecto del desempleo y el crecimiento sobre la rentabilidad de la inversión educacional : una aplicación a Colombia,9/1/1968,,
133,Criterios para decidir cuando deben prestarse los recursos del Gobierno Nacional provenientes de fondos de contrapartida y cuando darse como aporte,9/1/1968,,
134,Informe trimestral al BIRF sobre el estado de los proyectos del grupo consultivo,9/1/1968,,
135,Segunda revisión a la lista de proyectos presentados a la Cuarta Reunión del Grupo Consultivo enero 1969 - diciembre 1969,3/1/1969,,
141,Propuesta sobre normas y procedimientos para crear municipios,9/1/1968,,
146,Present and Future of the Colombian Power Industry,9/1/1968,,
147,Documento de préstamo para el proyecto modelo del Fondo Nacional de Caminos Vecinales y su reorganización administrativa,9/1/1968,,
148,Documento de préstamo para los diseños de la Central Hidroeléctrica del Alto Anchicaya,9/1/1968,,
149,Documento de préstamo para los diseños de la tercera fuente para el acueducto de Cali,9/1/1968,,
150,Documento de préstamo para el estudio de utilización de una fuente de abastecimiento de agua para la ciudad de Medellín,9/1/1968,,
151,Garantía del gobierno nacional para respaldar la financiación conjunta que conceden el Banco Mundial y los proveedores de ISA,9/1/1968,,
152,Informe de la Misión a Washington para la negociación del préstamo del Banco Mundial a la Sociedad ISA,9/1/1968,,
153,Consideraciones generales sobre el Fondo del Ahorro,9/1/1968,,
154,Garantía del gobierno nacional para respaldar la financiación que concede el BID al Instituto de Crédito Territorial,9/1/1968,,
155,Manual del archivo de consultores : clasificados de las firmas según nacionalidad y especialidad,10/1/1968,,
156,Situación financiera de las Empresas Públicas Municipales de Honda,9/1/1968,,
157,Préstamo AID-514-L-051 : desarrollo agropecuario : revisión del período que termina el 30 de septiembre 1968,10/1/1968,,
158,Datos básicos sobre la Hoya del Río Bogotá,10/1/1968,,
159,Estado de las contribuciones colombianas a la ONU y a los Organismos Especializados,9/1/1968,,
160,Modelo de contrato de garantía,10/1/1968,,
161,Préstamo AID-514-L-051 y 52.Promoción de exportaciones menores (revisión del período que termina el 30 de septiembre de 1968),10/1/1968,,
162,Plan de inversiones públicas 1968 : financiamiento adicional requerido,11/1/1968,,
163,"Resultados de la encuesta sobre los productos químicos derivados del petróleo, seleccionados por el grupo de estudio de la ALALC",10/1/1968,,
164,Estudio del transporte y del desarrollo urbano de Bogotá : términos de referencia,10/1/1968,,
165,Garantía del Gobierno Nacional para respaldar la ampliación del crédito No.2161 del Export Import Bank de los EE.UU.al Instituto de Aprovechamiento de Aguas y Fomento Eléctrico,11/1/1968,,
166,Recomendaciones del Consejo Nacional de Política Económica y Social a las entidades que intervienen en la regulación de los precios de artículos manufacturados y servicios,11/1/1968,,
167,Recomendaciones del Consejo Nacional de Política Económica y Social a las entidades encargadas del manejo de los precios de los bienes agropecuarios,11/1/1968,,
168,Proyecto de decreto sobre exenciones arancelarias a las entidades públicas,11/1/1968,,
169,Problema de la electrificación del Cauca y sus soluciones,11/1/1968,,
170,Propuesta al Consejo Nacional de Salarios sobre los términos de referencia para un estudio acerca de la situación del salario mínimo en las regiones del país,11/1/1968,,
171,Solicitud para extender los beneficios de Ley 81 de 1960 a proyectos hoteleros,11/1/1968,,
172,Informe financiero del Fondo Nacional de Proyectos de Desarrollo a 30 de septiembre de 1968,11/1/1968,,
173,Nuevos préstamos de programa : sus características y su alcance : memorando No.1,11/1/1968,,
174,Dificultades en el manejo de los préstamos de programa de la AID : memorando No.2,11/1/1968,,
175,"Solicitud de asistencia técnica al Programa de Desarrollo de las Naciones Unidas, para un estudio de transporte y desarrollo urbano de Bogotá",11/1/1968,,
176,Inversión de capital colombiano en el exterior : Fumigadoras Triunfo S.A.,11/1/1968,,
177,Conclusiones sobre el problema de la electrificación del Cauca y sus soluciones,11/1/1968,,
178,"Inversión de capital colombiano en el exterior : Gaseosas Lux, Gavirias 'CIA' Cia",11/1/1968,,
179,Lista de ideas de proyectos para presentar al Programa Mundial de Alimentos : diciembre 1968-diciembre 1969,12/1/1968,,
180,Proyecto de decreto por el cual de crea la Comisión Nacional de Tarifas de Servicios Públicos,12/1/1968,,
181,Inversión de capital colombiano en el exterior : Avianca en Santiago de Chile,12/1/1968,,
182,Alternativas de suministros de energía al Departamento del Huila,12/1/1968,,
183,Concepto de Planeación sobre la solicitud para el montaje de refinería y una térmica en Neiva,12/1/1968,,
185,Proyecto de estatuto de crédito público,12/1/1968,,
186,Informe sobre la producción y consumo de fertilizantes en Colombia,12/1/1968,,
187,El problema de la electrificación del Cauca y sus soluciones,1/1/1969,,
188,Conclusiones y recomendaciones sobre el problema de la electrificación del Cauca,1/1/1969,,
189,Informe del Consejo Nacional de Política Económica y Social sobre el resultado del tercer grupo consultivo,1/1/1969,,
190,Informe al Consejo Nacional de Política Económica y Social sobre la lista de proyectos que se presentarán a la cuarta reunión del grupo consultivo,1/1/1969,,
191,Inversiones de capital colombiano en el exterior : Helicópteros Nacionales de Colombia S.A,1/1/1969,,
192,Informe sobre la producción y consumo de semillas mejoradas en Colombia,1/1/1969,,
193,Documento de préstamo para el estudio de los yacimientos carboníferos del Cerrejón,1/1/1969,,
194,"Garantía del gobierno nacional para respaldar las operaciones de crédito entre el Export-Import Bank de los EE.UU., el Kreditanstalt fr Wiederaufbau de Alemania y la Empresa de Acueducto y Alcantarillado de Bogotá",1/1/1969,,
195,Indicadores económicos,1/1/1969,,
196,Estudio y evaluación de la reserva extraordinaria de fomento económico,1/1/1969,,
197,Solicitud del Gobierno de Colombia al Programa Mundial de Alimentos . 1 Etapa Plan Nacional de Alimentos,1/1/1969,,
198,Estudio sobre la posibilidad de una emisión de bonos del Gobierno de Colombia en el Mercado Financiero Internacional,1/1/1969,,
199,Garantía del Gobierno al préstamo del Kreditanstalt fr Wiederaufbau al Instituto de Fomento Industrial para proyectos de Electrificación en Nariño y desarrollo de la pequeña y mediana industria nacional,1/1/1969,,
200,Sugerencia sobre el contenido del eventual convenio entre el Gobierno de la República Federal de Alemania sobre ayuda de capital,1/1/1969,,
201,Nueva unidad turbogas para Barranquilla,1/1/1969,,
202,Informe sobre disponibilidad y uso de maquinaria agrícola en Colombia (versión preliminar),1/1/1969,,
203,Informe sobre inversión privada extranjera en Colombia,1/1/1969,,
204,Inversión de capital colombiano en el exterior : Banco Cafetero en Almacenar Ecuatoriana S.A,1/1/1969,,
205,Sextos Juegos Panamericanos de Cali 1971 : informe preliminar,1/1/1969,,
206,Proyecciones del crecimiento sectorial de Colombia 1966-1985,12/1/1968,,
207,"Proyecto de acuerdo de complementación sobre productos de las industrias químicas derivadas del petróleo : propuesto por empresarios de Argentina, México, Uruguay y Venezuela el 25 de noviembre de 1968",2/1/1969,,
208,Encuesta sobre recursos naturales renovables : manual para contestación del cuestionario,3/1/1969,,
209,Recomendaciones al Consejo Superior de Agricultura sobre el Instituto Latinoamericano de Mercadeo Agrícola,2/1/1969,,
210,Plan de desarrollo turístico regional de la costa oriental del Atlántico : resumen de los términos de referencia,2/1/1969,,
211,Garantía del Gobierno al préstamo del Export and Import Bank a ECOPETROL para la construcción de una Planta de Aromáticos,2/1/1969,,
212,Información sobre la inversión privada de Colombia en el exterior,2/1/1969,,
213,Cali - Solicitud de las autoridades departamentales y municipales al Presidente de la República - Visita 15-16 de febrero de 1969,2/1/1969,,
214,Documento de préstamo para los estudios del plan de desarrollo turístico de la costa oriental del Atlántico,2/1/1969,,
215,Plan de inversiones en el Río Magdalena y Canal del Dique,2/1/1969,,
216,Memorando sobre política de desarrollo económico del Gobierno de Colombia,3/1/1969,,
217,Proyecto de Ley por la cual se dictan disposiciones para la creación y supresión de municipios,3/1/1969,,
218,Reforma Constitucional : primeras medidas para desarrollar sus aspectos regionales y urbanos,3/1/1969,,
219,Indicadores económicos,2/1/1969,,
220,Sistemas especiales de importación y exportación,3/1/1969,,
221,"Electrificación en el contexto de los planes de desarrollo : Conferencia del doctor Edgar Gutiérrez Castro, Jefe del Departamento, en la asamblea anual de la Sociedad Colombiana de Ingenieros",3/1/1969,,
222,Asistencia técnica bilateral a Colombia proveniente del Gobierno del Reino de los Países Bajos,3/1/1969,,
223,Instituto de Asuntos Nucleares,3/1/1969,,
225,"Garantía del Gobierno al préstamo del BID al Instituto de Fomento Industria, para proyectos de desarrollo de la pequeña y mediana industria",3/1/1969,,
226,Garantía del Gobierno a la financiación de Thomson C.S.F.al Fondo Aeronáutico Nacional para el montaje de un sector de vigilancia en el Aeropuerto El Dorado,3/1/1969,,
227,"Información sobre productos de las industrias químicas y petroquímicas, suministrados por Argentina, Colombia, México, Uruguay y Venezuela",3/1/1969,,
228,Inversión de capital colombiano en el exterior : Banco de Colombia en Banco Popular del Ecuador,3/1/1969,,
229,"Inversión de capital colombiano en el exterior : Colombiana de Carburos y Derivados S.A.en Compuestos Nifilicos Ecuatorianos ""Covinec""",3/1/1969,,
230,Estudio de salarios mínimos : anexo estadístico,3/1/1969,,
231,Garantía del Gobierno Nacional al préstamo de Voest (Austria)para la adquisición y montaje de los equipos hidromecánicos de la Central Hidroeléctrica del Río Prado,3/1/1969,,
232,Garantía del gobierno nacional al préstamo del Export and Import Bank de los EE.UU.para adquisición de dos plantas para la ciudad de Santa Marta,3/1/1969,,
233,Tasas de interés para beneficiarios de préstamos de la Caja Agraria e INCORA con recursos del BIRF,3/1/1969,,
234,"Estudio de Proyecto de Convenio Constitutivo para el organismo Internacional de Seguros sobre Inversiones, preparado por el personal del Banco Mundial y sometido a la consideración de los directores ejecutivos del BIRF",3/1/1969,,
235,Estudio para la revisión de los salarios mínimos,3/1/1969,,
236,Pautas para al elaboración de solicitudes de préstamo externo en el campo educativo,3/1/1969,,
237,Solicitud de la Oficina de Cambios sobre una interpretación de la resolución 9 de 1968 del Consejo Nacional de Política Económica y Social,3/1/1969,,
